{
  "$schema": "./default-training-plan.schema.json",
  "schema_version": "2026.08.1",
  "contract_version": "1.0.0",
  "plan_code": "beginner_recomp_ab_v1",
  "plan_id": "10000000-0000-0000-0000-000000000000",
  "plan_version_id": "10000000-0000-0000-0000-000000000001",
  "version": 1,
  "status": "published",
  "name": "小白增肌减脂 A/B 全身计划",
  "description": "面向重新开始训练的小白：每周三次全身力量训练，A/B 按已完成训练交替，前两周每个位置最多 2 个正式组。",
  "goal": "增肌减脂",
  "cycle": [
    "A",
    "B"
  ],
  "weekly_strength_target": 3,
  "minimum_rest_days": 1,
  "fatigue_threshold": 8,
  "adaptation_weeks": 2,
  "adaptation_sets": 2,
  "target_rir": [
    2,
    3
  ],
  "selection_rule": "每个训练位置只选择首选动作或一个替代动作",
  "published_at": "2026-08-09T00:00:00Z",
  "days": [
    {
      "day_id": "9ec28948-bf0d-5dc8-842b-c4160d2fb654",
      "code": "A",
      "name": "A · 胸部优先",
      "order": 1,
      "slots": [
        {
          "slot_id": "20000000-0000-0000-0000-000000000001",
          "slot_code": "A01",
          "order": 1,
          "muscle_group": "胸部整体",
          "primary_exercise_id": "40000000-0000-0000-0000-000000000011",
          "sets": 3,
          "rep_min": 8,
          "rep_max": 10,
          "rep_unit": "reps",
          "rest_seconds": 120,
          "cues": "肩胛后缩并适度下沉；胸口打开；手腕中立；肘部与躯干约 30～60°；不要耸肩或让肩膀向前顶。",
          "common_mistakes": "耸肩、肩膀向前顶或臀部离开凳面。",
          "adaptation_sets": 2,
          "enabled": true,
          "options": [
            {
              "option_id": "30000000-0000-0000-0000-000000000011",
              "exercise_id": "40000000-0000-0000-0000-000000000011",
              "exercise_name": "杠铃平板卧推",
              "equipment_id": "1127d638-248e-549b-b13e-7d2ced697506",
              "equipment": "平板卧推架＋杠铃＋杠铃片",
              "is_primary": true,
              "order": 1,
              "sets": 3,
              "rep_min": 8,
              "rep_max": 10,
              "rep_unit": "reps",
              "rest_seconds": 120,
              "rir_min": 2,
              "rir_max": 3,
              "per_side": false,
              "enabled": true
            },
            {
              "option_id": "30000000-0000-0000-0000-000000000012",
              "exercise_id": "40000000-0000-0000-0000-000000000012",
              "exercise_name": "史密斯平板卧推",
              "equipment_id": "e2e12a88-77e0-5537-bcd9-15990d59fb37",
              "equipment": "史密斯机＋平凳",
              "is_primary": false,
              "order": 2,
              "sets": 3,
              "rep_min": 8,
              "rep_max": 12,
              "rep_unit": "reps",
              "rest_seconds": 120,
              "rir_min": 2,
              "rir_max": 3,
              "per_side": false,
              "enabled": true
            },
            {
              "option_id": "30000000-0000-0000-0000-000000000013",
              "exercise_id": "40000000-0000-0000-0000-000000000013",
              "exercise_name": "哑铃平板卧推",
              "equipment_id": "1344b845-57b4-5ebb-84ca-7e1a23fda295",
              "equipment": "哑铃＋平凳",
              "is_primary": false,
              "order": 3,
              "sets": 3,
              "rep_min": 8,
              "rep_max": 12,
              "rep_unit": "reps",
              "rest_seconds": 120,
              "rir_min": 2,
              "rir_max": 3,
              "per_side": false,
              "enabled": true
            },
            {
              "option_id": "30000000-0000-0000-0000-000000000014",
              "exercise_id": "40000000-0000-0000-0000-000000000014",
              "exercise_name": "坐姿推胸",
              "equipment_id": "659b0c02-4d4d-5f30-ac46-e8fb9bc39f61",
              "equipment": "坐姿推胸机",
              "is_primary": false,
              "order": 4,
              "sets": 3,
              "rep_min": 8,
              "rep_max": 12,
              "rep_unit": "reps",
              "rest_seconds": 120,
              "rir_min": 2,
              "rir_max": 3,
              "per_side": false,
              "enabled": true
            }
          ],
          "bench_angle": "0°"
        },
        {
          "slot_id": "20000000-0000-0000-0000-000000000002",
          "slot_code": "A02",
          "order": 2,
          "muscle_group": "背部宽度",
          "primary_exercise_id": "40000000-0000-0000-0000-000000000021",
          "sets": 3,
          "rep_min": 8,
          "rep_max": 12,
          "rep_unit": "reps",
          "rest_seconds": 90,
          "cues": "胸口微抬；先沉肩再屈肘；肘部向下和向髋部移动；不要拉到颈后；不要大幅后仰。",
          "common_mistakes": "拉到颈后或大幅后仰借力。",
          "adaptation_sets": 2,
          "enabled": true,
          "options": [
            {
              "option_id": "30000000-0000-0000-0000-000000000021",
              "exercise_id": "40000000-0000-0000-0000-000000000021",
              "exercise_name": "高位下拉",
              "equipment_id": "52e05eb2-7028-560c-814a-2fd895f4bd1d",
              "equipment": "高位下拉机",
              "is_primary": true,
              "order": 1,
              "sets": 3,
              "rep_min": 8,
              "rep_max": 12,
              "rep_unit": "reps",
              "rest_seconds": 90,
              "rir_min": 2,
              "rir_max": 3,
              "per_side": false,
              "enabled": true
            },
            {
              "option_id": "30000000-0000-0000-0000-000000000022",
              "exercise_id": "40000000-0000-0000-0000-000000000022",
              "exercise_name": "辅助引体向上",
              "equipment_id": "e2ed68fe-cdf6-5670-9959-6ea33f6cfcd3",
              "equipment": "辅助引体向上机",
              "is_primary": false,
              "order": 2,
              "sets": 3,
              "rep_min": 8,
              "rep_max": 12,
              "rep_unit": "reps",
              "rest_seconds": 90,
              "rir_min": 2,
              "rir_max": 3,
              "per_side": false,
              "enabled": true
            },
            {
              "option_id": "30000000-0000-0000-0000-000000000023",
              "exercise_id": "40000000-0000-0000-0000-000000000023",
              "exercise_name": "对握高位下拉",
              "equipment_id": "72de22f1-400c-5747-8a20-3a97709f3fc1",
              "equipment": "高位下拉机＋对握把手",
              "is_primary": false,
              "order": 3,
              "sets": 3,
              "rep_min": 8,
              "rep_max": 12,
              "rep_unit": "reps",
              "rest_seconds": 90,
              "rir_min": 2,
              "rir_max": 3,
              "per_side": false,
              "enabled": true
            },
            {
              "option_id": "30000000-0000-0000-0000-000000000024",
              "exercise_id": "40000000-0000-0000-0000-000000000024",
              "exercise_name": "自重引体向上",
              "equipment_id": "408ad055-4795-50f6-a8a6-850d41a044e3",
              "equipment": "引体向上架",
              "is_primary": false,
              "order": 4,
              "sets": 3,
              "rep_min": 1,
              "rep_max": 20,
              "rep_unit": "reps_rir_1_2",
              "rest_seconds": 120,
              "rir_min": 1,
              "rir_max": 2,
              "per_side": false,
              "enabled": true
            }
          ]
        },
        {
          "slot_id": "20000000-0000-0000-0000-000000000003",
          "slot_code": "A03",
          "order": 3,
          "muscle_group": "大腿前侧、臀部",
          "primary_exercise_id": "40000000-0000-0000-0000-000000000031",
          "sets": 3,
          "rep_min": 8,
          "rep_max": 12,
          "rep_unit": "reps",
          "rest_seconds": 120,
          "cues": "脚掌踩稳；膝盖跟随脚尖；腰臀稳定；不要骨盆卷起；顶端不要猛烈锁膝。",
          "common_mistakes": "骨盆卷起或顶端猛烈锁膝。",
          "adaptation_sets": 2,
          "enabled": true,
          "options": [
            {
              "option_id": "30000000-0000-0000-0000-000000000031",
              "exercise_id": "40000000-0000-0000-0000-000000000031",
              "exercise_name": "坐姿腿举",
              "equipment_id": "c26d8f38-bfb9-5fde-98e8-52d64c9e8cb6",
              "equipment": "坐姿腿举机或 45° 倒蹬机",
              "is_primary": true,
              "order": 1,
              "sets": 3,
              "rep_min": 8,
              "rep_max": 12,
              "rep_unit": "reps",
              "rest_seconds": 120,
              "rir_min": 2,
              "rir_max": 3,
              "per_side": false,
              "enabled": true
            },
            {
              "option_id": "30000000-0000-0000-0000-000000000032",
              "exercise_id": "40000000-0000-0000-0000-000000000032",
              "exercise_name": "哈克深蹲",
              "equipment_id": "599b55ec-ed8d-52a2-823c-22406e934cbb",
              "equipment": "哈克深蹲机",
              "is_primary": false,
              "order": 2,
              "sets": 3,
              "rep_min": 8,
              "rep_max": 12,
              "rep_unit": "reps",
              "rest_seconds": 120,
              "rir_min": 2,
              "rir_max": 3,
              "per_side": false,
              "enabled": true
            },
            {
              "option_id": "30000000-0000-0000-0000-000000000033",
              "exercise_id": "40000000-0000-0000-0000-000000000033",
              "exercise_name": "史密斯深蹲",
              "equipment_id": "9a9529f8-52d5-57c3-ba05-143f6546ae69",
              "equipment": "史密斯机",
              "is_primary": false,
              "order": 3,
              "sets": 3,
              "rep_min": 8,
              "rep_max": 12,
              "rep_unit": "reps",
              "rest_seconds": 120,
              "rir_min": 2,
              "rir_max": 3,
              "per_side": false,
              "enabled": true
            },
            {
              "option_id": "30000000-0000-0000-0000-000000000034",
              "exercise_id": "40000000-0000-0000-0000-000000000034",
              "exercise_name": "高脚杯深蹲",
              "equipment_id": "f0356b53-68bb-5760-91b6-cf5f95e8e98c",
              "equipment": "哑铃或壶铃",